Senior Jira Engineer, Delivering Atlassian expertise and skills; Partner closely with the Systems and Development teams to align on solution planning and project delivery ~  including managing project / program timelines ~  project scope., AmeriHome Mortgage, Westlake Village | CA, At least 5 years of professional experience in technical roles ~  with 2 years of experience administering at least one instance of JIRA; At least 50% of your work time spent administering or managing Atlassian applications for at least 2 years; We're looking for someone familiar with integrations with non-Atlassian tools such as (Power Scripts ~  Microsoft SQL Server ~  G Suite ~  Active Directory).
Software Project Manager, Manage project details ~  schedules ~  client communications ~  development tasks ~  and documentation for web based .Net applications; Assist in ongoing efforts to improve and streamline a quality focused software management process; Create technical design documents and other project documentation; Manage details for multiple long-term software projects; Contribute to the ongoing creation of a quality focused project management process; Manage tasks and sprints for a team of 5 developers., Efficiency Lab, Asheville | NC, Must have 3+ years experience managing software projects; Must be able to understand technical details related to engineering software applications; Must have experience managing software projects using an Agile methodology; Experience with engineering ~  manufacturing and scientific projects is desired; Experience with Atlassian project management tools is desired (Jira & Confluence).
Database Engineer, Relentless focus on system availability and performance ~  putting key monitoring and alerting systems in place and generating key learning from even the smallest of issues; Architect systems for high availability ~  with constant attention to Recovery Point and Recovery Time Objectives; Perform daily system monitoring for database integrity ~  scheduled jobs ~  backups ~  and system logs; Partner with developers to create efficient database designs (data types ~  stored procedures ~  views ~  functions); Create and execute a cloud migration strategy to move on-premises systems to the cloud; Continuously monitor infrastructure costs to optimize for spend; Adopt Continuous Integration and Delivery processes to automatically build ~  test ~  and deploy code; Create an environment where security is a top priority. In addition to responding to security audit findings ~  help the team “shift left” and integrate security earlier in the software development lifecycle; Key contributor to a technology roadmap; Provide mentoring and identify training opportunities to team members ~  staying current in the latest technologies and best practices., Signant Health, Blue Bell | PA, Expert in Microsoft SQL Server ~  with at least 5 years experience as a Database Engineer or DBA; Strong experience in high availability database design and architecture; Experience migrating to and managing cloud database technology (Azure SQL or Amazon RDS); Experience in a modern software development environment that is Agile and incorporates DevOps practices; Data Warehousing and Business Intelligence; Artificial Intelligence ~  Machine Learning ~  Data Mining; BI Tools like PowerBI ~  Tableau ~  Qlik; CI/CD processes and tools like Jenkins; Strong foundation in security ~  having executed security audits and remediating findings; BS degree in Computer Science or related discipline.
Jira and Confluence Expert, Driving your own projects ~  from design through planning to execution. Also work with teams across Amazon on cross-team initiatives; Planning and coordinating feature improvements and upgrades around services; Improving the user experience around services; Analyzing and improving availability ~  efficiency ~  capacity ~  scalability ~  security and performance of our services; Representing Systems Operations while working with internal teams and external partners; Troubleshooting and resolving problems with production systems as part of our on-call rotation; Developing and maintaining operations tools., Amazon.com Services LLC, Sunnyvale | CA, Master's degree; Excellent customer service ~  communication ~  documentation ~  work prioritization and analytical skills; Carving out requirements around ambiguous projects; Ability and willingness to go above and beyond one’s comfort zone when it comes to learning about other infrastructure services to help integrate and improve them; Tuning applications for performance; Energy and passion to invent and create new solutions ~  challenge the status quo and drive positive change.
Frontend Engineer, Work directly with product managers ~  designers and developers on features for the Trello web application; Proactively optimize client code to ensure stability and high performance; Iterate quickly based on user feedback., Atlassian, New York | NY, You could be working at any level of the stack ~  but you’re passionate about front-end development; You have in-depth experience with a framework like AngularJS ~  Backbone.js (our current framework) or React (what we’re moving to); You have enough back-end experience to jump over to the server to unblock yourself (we use node.js); You’re passionate about understanding user problems and working with a team to ship and iterate on great solutions; You strive to write code that lasts for years ~  not months; You have a diverse technical background. You’re a developer ~  not just a front-end developer; You know the difference between ECMAScript and JavaScript ~  and are proud (or slightly ashamed) of it; You can tweak CSS ~  but you prefer profiling ~  analyzing heap snapshots ~  and refactoring code into modular chunks; You have an excellent command of written and spoken English.
Field Application Engineer, Creation of the initial configuration of prototypes for Customer-specific projects; Composition of Quick Start Guides and Application Notes; Provide technical trainings and assistance to Customers and Sales Team; Deliver Design-In Support to Customers alongside with Product Management and Sales; Definition of cable assemblies incl. creation of cable drawings for off-site production; Assist Customers with After-Sales Support Configuration and assembly of Demo Units and Sample Kits for the Sales Team and Trade Shows., DATA MODUL, Hauppauge | NY, Minimum of 3 years of Engineering experience; Solid and fluent English language skills; Basic skills in Microsoft® Windows and Linux Operating Systems; Comfortable and efficient in the use of Microsoft® Office ~  i.e. Outlook ~  Word ~  Excel & PowerPoint.
IT Support Engineer, Provide ongoing support and education for our users: answer questions ~  diagnose and troubleshoot problems ~  and train our users; Be an IT ambassador and provide a best-in-class support experience; Maintain and support Zoom Rooms and A/V hardware; provide technical A/V support for events; Maintain IT asset management of our hardware and software; Onboard new employees and orient them with Flatiron's systems ~  applications ~  and IT policies; Update and add to help documentation for internal team use and employee use; Participate in our rotating on-call support schedule; Complete project-based work that contributes to our team's objectives., Flatiron Health, New York | NY, You have experience in an enterprise IT environment ~  supporting and administering SaaS applications. We use many ~  including GSuite ~  Zendesk ~  Egnyte ~  Jira and Confluence ~  and LastPass; You have used Bettercloud to automate simple SaaS administrative tasks; You have experience managing policies ~  packages ~  and OS deployment using JAMF and/or SCCM; Extensive Zoom Room configuration and maintenance experience; You understand network protocols and services (TCP ~  UDP ~  TCP/IP ~  DNS ~  DHCP) and can troubleshoot our employee's network issues; You are customer service driven and practice empathy while supporting employees; You don't follow the same recipe all the time and you challenge the status quo. You don't settle for the "have you restarted your computer" fix; you strive to understand the root cause of an issue; You build relationships and trust with your peers and our employees. You can work on projects with your team or cross-functionally ~  and you are not afraid to get your hands dirty; You have a growth mindset; you are curious and want to learn. You endeavor to be a mentor and help develop your peers.
Quality Assurance Engineer, Review testcases with the territory (US Market) expertise and be able to use your own initiative to add value to the current test pack for testing the applications to the core that are being built by off-shore team; Understand the proposition and use your expertise in coming up with ‘out of the box’ scenarios using the current territory (US Market) knowledge; Create and perform standard release regression test verification (per platform) to confirm successful code deployments and mobile store submissions; Be able to repeat the test packs manually across the whole suite of OTT devices in scope; Participate in daily scrum calls with remote teams to support issues’ triage process and understand prioritization of work assignments; Manage the creation ~  updates and status of issues detected during the test execution phase; Manage the retest ~  updates and status of issues reported by other project stakeholders; Report Test execution status to Test Managers ~  Project Managers and Release Managers to ensure that all project deliverables are appropriately verified and approved for both distribution for owner verification and for final code deployment/ submission; Cover both E2E & UAT Testing from a customer’s perspective., NBCUniversal, New York | NY, Minimum two (2) years’ Quality Assurance process and Quality Assurance management tool experience; Minimum five (5) years’ of website support and web applications experience; Minimum two (2) years’ in software test automation in a continuous integration and continuous deployment environment; Familiarity with agile development methodologies and full software development lifecycle ~  especially with web ~  mobile ~  connected device and OTT applications; Familiarity with current popular Connected Device/OTT (tvOS/Apple TV ~  Roku ~  Fire TV ~  Android TV ~  Xbox One ~  PS4 ~  etc.); Familiarity with applications supporting video/media playback; Experience with building test plans and coordinating QA/UAT with functional teams; Ability to adapt/adopt new technology and solutions easily; Good understanding of networking ~  SSL ~  firewalls ~  Akamai; Experience with Charles proxy ~  Splunk or similar logging tools; Experience with Jira ~  Slack ~  Confluence collaboration tools; Experience with TestRails ~  Quality Center or similar test case management tools; Hands on experience with set-top box automation such as Witbe or FalconEye.
Backend Engineer, Add and support new features in Trello that will ship to over 50 million users; Work with Product Managers ~  Designers ~  and other Developers to refine feature design and functionality; We use the following technologies on the back-end team at Trello: JavaScript / CoffeeScript ~  Node.js ~  Mongo ~  - Redis.; Experience in these particular technologies isn’t a requirement for applying ~  but you’ll be using them daily., Atlassian, New York | NY, You have experience improving large scale web applications; You prefer to focus on server work with occasional full-stack tasks; You have a passion for making features that are quick ~  useful ~  and easy to use; You strive to master any technology ~  language ~  or development environment that is needed or useful; You’re a fast learner ~  can contribute from day one ~  and can bring good opinions to the table; You have an excellent command of written and spoken English ~  and communicate about what you're doing with your coworkers.
Scrum Master, Organizes newly formed or changing product development teams. Onboards and trains new team members on the agile mindset ~  frameworks ~  processes and frameworks; Introduces and encourages the team to explore healthy Agile development practices ~  focusing on quality and technical excellence ~  predictable delivery ~  automation ~  and continuous delivery; Partners closely with product managers and the team to encourage a balanced backlog that delivers valuable features for customers ~  reduces technical debt ~  provides business value ~  and enables product sustainability; Organizes and improves agile/scrum practices and values ~  increasing productivity and overall team satisfaction. Assesses the scrum maturity of the team and coaches team members to higher levels of maturity at a pace that is sustainable and comfortable for the team while removing impediments or coaching the team to self-organize to unblock their flows; Leads ~  coordinates ~  facilitates and/or guides all sprint ceremonies ~  depending on the meeting. These ceremonies include the daily stand-up ~  sprint planning ~  sprint demo ~  sprint retrospective and backlog refinement; Helps the team to develop ~  capture ~  and analyze metrics to facilitate team improvements; Serves as the sprint gatekeeper in the pre-sprint ~  during sprint ~  and post-sprint phases ensuring that all necessary requirements are provided ~  milestone dates are met ~  and continuous feedback is being actioned; Coordinates with other scrum masters and release train engineers/managers to eliminate impediments and ensure the smooth movement of development phases and releases; Assists product owners and project managers in preparing and refining the backlog for Program Increment (large scale planning) as well as iteration/sprint planning; Owns the JIRA & Confluence systems with regards to process flows ~  kanban boards ~  clean-up activities ~  maintenance and organization of documentation ~  transparency and reporting in addition to supporting the research and implementation of tools and plug-ins to improve efficiency., The New York Times, New York | NY, You have some exposure to being a scrum master (1-2 yrs); You have strong interpersonal ~  written ~  verbal and presentation skills; You have demonstrated ability to work across multiple teams; You have demonstrated ability to partner and liaison between business users and a technical development team; You have sensitivity to the multi-cultural characteristics of a global IT organization; You love to learn ~  take feedback well and do not shy away from a challenge.
QA Engineer, Perform manual and automated software quality assurance testing; Ensure that all feature deliverables meet quality objectives; Evaluate use cases and software requirements to create test plans ~  test cases ~  execute test cases ~  document results ~  and record defects; Work with various teams ~  including product managers ~  developers ~  designers ~  and others to understand project goals and testing needs; Coordinate testing within an agile development framework; Work with the product team to help groom stories with a QA mindset; Review production issues to verify if they are defects and handle accordingly., OnlineMedEd, Austin | TX, 3-4 years of QA experience in an agile environment; Strong understanding of agile methodologies; Ability to document steps to reproduce observed defects; Strong written and verbal communication skills; Team player and self-starter attitude with a high level of initiative; Ability to be flexible in a fast-paced and always-changing work environment; Experience maintaining and expanding test suites.
Software Quality Assurance Engineer, Work closely with cross functional sprint teams to qualify and prepare to release Ring products and corresponding companion applications (mobile and web apps); Develop test plans and test cases mapping to product requirements and technical implementations; Prepare and distribute test reports and release readiness reports for stakeholder reviews; Actively contribute to QA support functions - UI and API Automation ~  triage issues ~  troubleshoot issues ~  conduct API tracing ~  and support production release testing., Amazon.com Services LLC, Malvern | PA, Hands on experience working with IDEs - Android studio ~  Xcode ~  and intelli J; Knowledge of wireless connectivity technologies ~  such as wifi ~  Bluetooth ~  ZWave ~  and Zigbee; Experience with QA report management tools - Jira ~  Confluence ~  and Testrail; Experience with production monitoring and deployment tools – Splunk ~  Kibana ~  Datadog ~  and Jenkins; Knowledge of IOT device development or testing ~  specifically Home Security Systems; Knowledge of testing Alexa Skills and Alexa Voice Services; Good communication and interpersonal skills; Strong organizational skills to plan and delivery quality products on time.
Software Engineer, Optimizing application code for high performance on UNIX-type workstations as well as LINUX servers and to ensure efficient use of computing resources in general; Integrating ~  testing ~  and supporting software developed by other centers or development partners; Maintaining the software test environment to support migration activities ~  including auto-builds of stand-alone executables on servers; execution outside of Eclipse environment; and simulation of user operations., Ace Info Solutions ~  Inc., Riverdale Park | MD, Experience with Angular.js ~  Node.js ~  and/or Vue.js; Experience with Jira and Confluence; Experience with Git and GitLab CI/CD; Experience in AGILE development.
Senior Data Engineer, Deliver data solutions and services that support the internal business intelligence team; Partner with internal stakeholders ~  architects ~  engineers ~  data analysts and other technical partners to gather requirements ~  understand existing systems and develop data solution; Collaborate with data analysts to conduct in-depth research to identify data sources ~  issues and propose solutions; Determine the most appropriate data collection and methodologies; Identify ~  retrieve ~  manipulate ~  relate and exploit multiple structured data and unstructured data sets from various sources ~  including building or generating new data sets as appropriate; Integrate operational data platforms and tools including Tableau ~  SNS ~  SQS ~  Redshift ~  Postgres ~  etc.; Leverage subject matter expertise in ERP ~  APIs ~  enterprise application event-streaming ~  and middleware; Collaborate through the Agile methodology to deliver products and key features ~  including the use of Agile tools like Jira and Confluence., The Bernard Group, Chanhassen | MN, Be technically savvy with computer skills ~  including data management software ~  and other computer applications; Must be able to have the mechanical aptitude to comprehend complex instructions and apply that learning to effectively & efficiently analyze and cleanse client data; Make the right call with quality decisions ~  good judgment and keen problem-solving skills in determining better ~  more efficient work flows with the same high-quality standard; Exhibit strong critical thinking skills and be extremely detail-oriented to ensure the highest quality of database cleansing and management is the output; Drive results ~  take initiative and be action-oriented by applying time management and self-management skills every day in order to meet deadlines while maintaining a positive attitude; Be accountable and take ownership of work commitments in meeting clients' expectations and timelines; Collaborate and embrace the "Art of the Team" by working with Sales ~  Design ~  Production and Purchasing teams in order to get the work done on-time and within budget; Have a passion for excellence and drive for quality in all that the team produces; Be empathetic while problem-solving with clients and other team members ~  and stay process-focused when problem-solving.
DevOps / Network Engineer, Supporting our enterprise class security infrastructure and disaster recovery operation including backups ~  Palo Alto NexGen Firewalls ~  F5 BigIPs ~  state of the art colocation facilities and a remote DR site; Automating customer-facing ~  highly-available web applications running on linux servers ~  in containers and using configuration management/containerization tools including Docker ~  Kubernetes ~  and Chef; Work on corporate systems including Active Directory ~  Exchange ~  LDAP ~  Confluence ~  and JIRA; Responsible for designing ~  building ~  and operation of systems to support our customer-facing web applications and the multi terabytes of data that support them., Northern Light, Birmingham | AL, BS or MS in Computer Science ~  Computer Engineering ~  or equivalent technical experience demonstrating strong CS fundamentals; At least 5 years industry experience with 3+ years working in Technical Operations / DevOps / System Administration.
Senior Full Stack Engineer (Digital), Build high-performance ~  web-based applications with React and PHP; Implement HTML layouts in React/JSX based on wireframes; Implement CSS to style components based on style guide and design comps; Build secure ~  scalable APIs using GraphQL; Participate in design of database models; Build application features in a fast-paced environment; Provide code reviews for fellow React and PHP developers., Codazen, Laguna Hills | CA, Minimum of 5+ years experience building web-based software or enterprise-level web sites; Excellent interpersonal and teamwork skills; A passion for creating high quality software and user experience; B.S. in Computer Science or related program at an accredited college or university ~  or equivalent practical experience; An appreciation for the importance to strike a balance between getting code out quickly and following best practices. We move fast ~  but we like to build good software and manage risk carefully; Excellent communicator: comfortable explaining technical problems in person and in writing; Strong sense of responsibility and ownership; you will have come from an environment in which people are responsible for their own code; Deeply understand what drives the business for which you are building software. We firmly believe that what separates a good developer from a great one is a deep understanding of the business that they are supporting; Work with your QA resources to ensure that the software you deliver is of the highest quality; Act as a key member of the product launch team and work closely to DevOps to resolve operational issues; Work on an elite and passionate team to create software that moves our business forward; Evaluate emerging technologies to identify opportunities ~  trends and best practices that can be leveraged to strengthen our platform and development practices; Willingness to take an active role in mentoring other developers.
Software Engineer – iOS and Android ~  IoT, Develop new features or bug fixes for our backend solutions; Work with engineering team on IoT integrations with hardware products; Work with design team on implementing new application designs; Perform unit and functional testing to ensure the quality of your work; Work with the support team to identify and resolve issues; Experiment and create proof of concept prototypes for new features; Develop new features or bug fixes for our mobile apps (iOS ~  Android ~  and Flutter-based)., AutoPets, Auburn Hills | MI, BS in Computer Science or Computer Engineering ~  or equivalent in experience; 2+ years of experience developing for backend services; Familiarity with AWS systems ~  including AWS IoT Core and Lambda; Experience developing APIs; Experience with SQL; Strong communication skills both written and verbal; Ability to work closely with design staff and to implement design direction; Ability to take ideas from concept to prototype; Ability to work in cross-functional teams; Ability to write clean code with an emphasis on maintainability; Familiarity with SOLID principles; The desire to learn constantly and dive into new areas with unfamiliar technologies.
Lead QA Engineer, Ownership of the process around establishing our QA team and best practices to create a culture of developing and shipping a consistently high-quality product; Collaborating with Product Management and Engineering to understand project requirements in order to design test plans that meet our company objectives with respect to reliability ~  usability ~  and performance; Performing acceptance testing during our normal sprint cycles; Identify ~  report ~  and drive bugs to resolution by owning the bug backlog; Continuously improve and streamline our test process ~  establish and maintain good patterns ~  and integrate automated tests into our release pipeline; Advise stakeholders and engineers regarding usability and testability issues; Share knowledge with other engineers to help establish and cultivate our testing culture., Prism.fm, Austin | TX, 3+ years in Quality Assurance role; 1+ years of JavaScript experience; Experience in organizing ~  writing ~  and executing test cases; Experience running tests in CI/CD workflow; Ability to translate use cases and/or technical specifications into test cases; Well-versed in Quality Assurance best practices and methodologies; Knowledgeable of software development methodologies.
